{
  "source": {
    "implementation": "otfabric-handwritten",
    "version": "n/a",
    "image_digest": "none"
  },
  "capture": {
    "direction": "server-to-client",
    "transport": "bacnet-ip-udp",
    "original_endpoint": "lab-synthetic"
  },
  "standard": {
    "base": "ANSI/ASHRAE 135-2024",
    "protocol_revision": 31,
    "clauses": ["13.8"]
  },
  "license": {
    "status": "independently-generated"
  },
  "id": "service-event-notification-seq",
  "description": "EventNotification with sequence TimeStamp, alarm to offnormal",
  "expect": {
    "semantic_decode_equal": true,
    "deterministic_reencode_equal": true,
    "original_bytes_equal": true
  },
  "input_hex": "09011c020000642c008000013e19073f4901590369008900b901",
  "tags": ["service", "event-notification", "horizon-2", "gate-3"],
  "operation": "decode_event_notification",
  "expected": {
    "process_identifier": 1,
    "device": {"type": 8, "instance": 100},
    "object": {"type": 2, "instance": 1},
    "sequence": 7,
    "priority": 3,
    "to_state": 1
  }
}
