{
  "source": {
    "implementation": "otfabric-handwritten",
    "version": "n/a",
    "image_digest": "none"
  },
  "capture": {
    "direction": "client-to-server",
    "transport": "bacnet-ip-udp",
    "original_endpoint": "lab-synthetic"
  },
  "standard": {
    "base": "ANSI/ASHRAE 135-2024",
    "protocol_revision": 31,
    "clauses": ["13.5"]
  },
  "license": {
    "status": "independently-generated"
  },
  "id": "service-acknowledge-alarm",
  "description": "AcknowledgeAlarm with sequence timestamps and source ops",
  "expect": {
    "semantic_decode_equal": true,
    "deterministic_reencode_equal": true,
    "original_bytes_equal": true
  },
  "input_hex": "09011c0080000129013e19073f4c006f70735e19085f",
  "tags": ["service", "acknowledge-alarm", "horizon-2", "gate-3"],
  "operation": "decode_acknowledge_alarm",
  "expected": {
    "process_identifier": 1,
    "object": {"type": 2, "instance": 1},
    "event_state_acked": 1,
    "source": "ops"
  }
}
