{
  "source": {
    "implementation": "otfabric-handwritten",
    "version": "n/a",
    "image_digest": "none"
  },
  "capture": {
    "direction": "constructed",
    "transport": "bacnet-ip-udp",
    "original_endpoint": "lab-synthetic"
  },
  "standard": {
    "base": "ANSI/ASHRAE 135-2024",
    "protocol_revision": 31,
    "clauses": [
      "Annex J"
    ]
  },
  "license": {
    "status": "independently-generated"
  },
  "id": "bvlc-register-foreign-device-ttl-60",
  "description": "BVLC Register-Foreign-Device with TTL 60 seconds",
  "expect": {
    "semantic_decode_equal": false,
    "deterministic_reencode_equal": true,
    "original_bytes_equal": true
  },
  "input_hex": "81050006003c",
  "tags": [
    "bvlc",
    "foreign-device",
    "horizon-1",
    "gate-3"
  ],
  "notes": "semantic_decode_equal deferred until operation/expected is authored."
}
