{
  "source": {
    "implementation": "otfabric-handwritten",
    "version": "n/a",
    "image_digest": "none"
  },
  "capture": {
    "direction": "constructed",
    "transport": "bacnet-ip-udp",
    "original_endpoint": "lab-synthetic"
  },
  "standard": {
    "base": "ANSI/ASHRAE 135-2024",
    "protocol_revision": 31,
    "clauses": [
      "6",
      "16"
    ]
  },
  "license": {
    "status": "independently-generated"
  },
  "id": "npdu-local-who-is",
  "description": "Local NPDU carrying Unconfirmed Who-Is (no bounds)",
  "expect": {
    "semantic_decode_equal": false,
    "deterministic_reencode_equal": true,
    "original_bytes_equal": true
  },
  "input_hex": "01001008",
  "tags": [
    "npdu",
    "apdu",
    "discovery",
    "horizon-1",
    "gate-3"
  ],
  "notes": "semantic_decode_equal deferred until operation/expected is authored."
}
