{
  "source": {
    "implementation": "otfabric-handwritten",
    "version": "n/a",
    "image_digest": "none"
  },
  "capture": {
    "direction": "client-to-server",
    "transport": "bacnet-ip-udp",
    "original_endpoint": "lab-synthetic"
  },
  "standard": {
    "base": "ANSI/ASHRAE 135-2024",
    "protocol_revision": 31,
    "clauses": ["16.4"]
  },
  "license": {
    "status": "independently-generated"
  },
  "id": "service-reinitialize-device-warmstart",
  "description": "ReinitializeDevice warmstart without password",
  "expect": {
    "semantic_decode_equal": true,
    "deterministic_reencode_equal": true,
    "original_bytes_equal": true
  },
  "input_hex": "0901",
  "tags": ["service", "reinitialize-device", "horizon-2", "gate-3"],
  "operation": "decode_reinitialize_device",
  "expected": {
    "state": 1
  }
}
