{
  "source": {
    "implementation": "otfabric-handwritten",
    "version": "n/a",
    "image_digest": "none"
  },
  "capture": {
    "direction": "client-to-server",
    "transport": "bacnet-ip-udp",
    "original_endpoint": "lab-synthetic"
  },
  "standard": {
    "base": "ANSI/ASHRAE 135-2024",
    "protocol_revision": 31,
    "clauses": [
      "12"
    ]
  },
  "license": {
    "status": "independently-generated"
  },
  "id": "service-get-enrollment-summary-ack",
  "description": "GetEnrollmentSummary ACK with one AV OutOfRange entry",
  "expect": {
    "semantic_decode_equal": true,
    "deterministic_reencode_equal": true,
    "original_bytes_equal": true
  },
  "input_hex": "c4008000019105910121642101",
  "tags": [
    "service",
    "enrollment-summary"
  ],
  "operation": "decode_get_enrollment_summary_ack",
  "expected": {
    "entry_count": 1,
    "object": {
      "type": 2,
      "instance": 1
    },
    "notification_class": 1
  }
}
