{
  "source": {
    "implementation": "otfabric-handwritten",
    "version": "n/a",
    "image_digest": "none"
  },
  "capture": {
    "direction": "client-to-server",
    "transport": "bacnet-ip-udp",
    "original_endpoint": "lab-synthetic"
  },
  "standard": {
    "base": "ANSI/ASHRAE 135-2024",
    "protocol_revision": 31
  },
  "license": {
    "status": "independently-generated"
  },
  "id": "apdu-segment-ack",
  "description": "SegmentACK invoke=5 seq=0 window=1",
  "expect": {
    "semantic_decode_equal": true,
    "deterministic_reencode_equal": true,
    "original_bytes_equal": true
  },
  "input_hex": "40050001",
  "tags": [
    "apdu",
    "segmentation",
    "horizon-1",
    "gate-3"
  ],
  "operation": "decode_segment_ack",
  "expected": {
    "invoke_id": 5,
    "sequence_number": 0,
    "window_size": 1
  }
}
