{
  "source": {
    "implementation": "bacnet4j",
    "version": "6.1.0",
    "image_digest": "none"
  },
  "notes": "CreateObjectRequest.write AV-101 with Object_Name initial value",
  "capture": {
    "direction": "client-to-server",
    "transport": "bacnet-ip-udp",
    "original_endpoint": "lab-synthetic"
  },
  "standard": {
    "base": "ANSI/ASHRAE 135-2024",
    "protocol_revision": 31,
    "clauses": [
      "12",
      "21"
    ]
  },
  "license": {
    "status": "independently-generated"
  },
  "id": "service-create-object-with-initial-values",
  "description": "CreateObject AV-101 with listOfInitialValues [1] Object_Name",
  "expect": {
    "semantic_decode_equal": true,
    "deterministic_reencode_equal": true,
    "original_bytes_equal": true
  },
  "input_hex": "0e1c008000650f1e094d2e750f0041562d435245415445442d3130312f1f",
  "tags": [
    "service",
    "create-object"
  ],
  "operation": "decode_create_object",
  "expected": {
    "object": {
      "type": 2,
      "instance": 101
    },
    "initial_value_count": 1,
    "object_name": "AV-CREATED-101"
  }
}
