{
  "source": {
    "implementation": "otfabric-handwritten",
    "version": "n/a",
    "image_digest": "none"
  },
  "capture": {
    "direction": "client-to-server",
    "transport": "bacnet-ip-udp",
    "original_endpoint": "lab-synthetic"
  },
  "standard": {
    "base": "ANSI/ASHRAE 135-2024",
    "protocol_revision": 31,
    "clauses": [
      "12"
    ]
  },
  "license": {
    "status": "independently-generated"
  },
  "id": "service-atomic-write-file-stream",
  "description": "AtomicWriteFile stream access request",
  "expect": {
    "semantic_decode_equal": true,
    "deterministic_reencode_equal": true,
    "original_bytes_equal": true
  },
  "input_hex": "0c028000011e3100650568656c6c6f1f",
  "tags": [
    "service",
    "file"
  ],
  "operation": "decode_atomic_write_file",
  "expected": {
    "file": {
      "type": 10,
      "instance": 1
    },
    "access": "stream",
    "data": "hello"
  }
}
