{
  "source": {
    "implementation": "otfabric-handwritten",
    "version": "n/a",
    "image_digest": "none"
  },
  "capture": {
    "direction": "client-to-server",
    "transport": "bacnet-ip-udp",
    "original_endpoint": "lab-synthetic"
  },
  "standard": {
    "base": "ANSI/ASHRAE 135-2024",
    "protocol_revision": 31,
    "clauses": [
      "12"
    ]
  },
  "license": {
    "status": "independently-generated"
  },
  "id": "service-get-alarm-summary-req",
  "description": "Empty GetAlarmSummary request payload",
  "expect": {
    "semantic_decode_equal": true,
    "deterministic_reencode_equal": true,
    "original_bytes_equal": true
  },
  "input_hex": "",
  "tags": [
    "service",
    "alarm-summary"
  ],
  "operation": "decode_get_alarm_summary",
  "expected": {}
}
