{
  "source": {
    "implementation": "otfabric-handwritten",
    "version": "n/a",
    "image_digest": "none"
  },
  "capture": {
    "direction": "client-to-server",
    "transport": "bacnet-ip-udp",
    "original_endpoint": "lab-synthetic"
  },
  "standard": {
    "base": "ANSI/ASHRAE 135-2024",
    "protocol_revision": 31,
    "clauses": [
      "15.9"
    ]
  },
  "license": {
    "status": "independently-generated"
  },
  "id": "service-write-property-null-priority-8",
  "description": "WriteProperty Null relinquish at priority 8 for AV:1 present-value",
  "expect": {
    "semantic_decode_equal": false,
    "deterministic_reencode_equal": true,
    "original_bytes_equal": true
  },
  "input_hex": "0c0080000119553e003f4908",
  "tags": [
    "service",
    "write-property",
    "horizon-1",
    "gate-3"
  ],
  "notes": "semantic_decode_equal deferred until operation/expected is authored."
}
