{
  "source": {
    "implementation": "otfabric-handwritten",
    "version": "n/a",
    "image_digest": "none"
  },
  "capture": {
    "direction": "client-to-server",
    "transport": "bacnet-ip-udp",
    "original_endpoint": "lab-synthetic"
  },
  "standard": {
    "base": "ANSI/ASHRAE 135-2024",
    "protocol_revision": 31,
    "clauses": [
      "12"
    ]
  },
  "license": {
    "status": "independently-generated"
  },
  "id": "service-add-list-element",
  "description": "AddListElement for device object-list",
  "expect": {
    "semantic_decode_equal": true,
    "deterministic_reencode_equal": true,
    "original_bytes_equal": true
  },
  "input_hex": "0c020004d2194c3ec4008000013f",
  "tags": [
    "service",
    "list-element"
  ],
  "operation": "decode_list_element",
  "expected": {
    "object": {
      "type": 8,
      "instance": 1234
    },
    "property": 76,
    "element_count": 1
  }
}
