{
  "source": {
    "implementation": "otfabric-handwritten",
    "version": "n/a",
    "image_digest": "none"
  },
  "capture": {
    "direction": "client-to-server",
    "transport": "bacnet-ip-udp",
    "original_endpoint": "lab-synthetic"
  },
  "standard": {
    "base": "ANSI/ASHRAE 135-2024",
    "protocol_revision": 31,
    "clauses": [
      "12"
    ]
  },
  "license": {
    "status": "independently-generated"
  },
  "id": "service-you-are",
  "description": "You-Are identity assignment",
  "expect": {
    "semantic_decode_equal": true,
    "deterministic_reencode_equal": true,
    "original_bytes_equal": true
  },
  "input_hex": "2203e772006d720073c4020004d2",
  "tags": [
    "service",
    "identity"
  ],
  "operation": "decode_you_are",
  "expected": {
    "vendor_id": 999,
    "device": {
      "type": 8,
      "instance": 1234
    }
  }
}
